{
  "$schema": "https://json-schema.org/draft/2020-12/schema",
  "$id": "https://specs.clavenar.com/contracts/ledger-chain-v5.schema.json",
  "title": "Clavenar immutable Ledger chain v5 policy",
  "type": "object",
  "additionalProperties": false,
  "required": [
    "schemaVersion",
    "contract",
    "currentWriterChainVersion",
    "historicalChainVersions",
    "canonicalization",
    "hash",
    "fieldOrder",
    "requiredValueFields",
    "nullableFields",
    "excludedState",
    "payloadIntegrity",
    "verifiedCommitment",
    "adversarialMutations"
  ],
  "properties": {
    "schemaVersion": {"const": 1},
    "contract": {"const": "clavenar.ledger-chain/v5"},
    "currentWriterChainVersion": {"const": 5},
    "historicalChainVersions": {
      "type": "array",
      "prefixItems": [
        {"const": 1},
        {"const": 2},
        {"const": 3},
        {"const": 4}
      ],
      "items": false,
      "minItems": 4,
      "maxItems": 4
    },
    "canonicalization": {
      "type": "object",
      "additionalProperties": false,
      "required": ["serializer", "objectFieldOrder", "optionalEncoding", "timestampEncoding"],
      "properties": {
        "serializer": {"const": "serde-json-struct-order/v1"},
        "objectFieldOrder": {"const": "fieldOrder"},
        "optionalEncoding": {"const": "explicit-null"},
        "timestampEncoding": {"const": "chrono-rfc3339-utc"}
      }
    },
    "hash": {
      "type": "object",
      "additionalProperties": false,
      "required": ["algorithm", "input", "output", "genesisPrevHash"],
      "properties": {
        "algorithm": {"const": "sha256"},
        "input": {"const": "prev_hash || 0x7c || canonical_json(hashable_v5)"},
        "output": {"const": "lowercase-hex-64"},
        "genesisPrevHash": {"const": "0000000000000000000000000000000000000000000000000000000000000000"}
      }
    },
    "fieldOrder": {
      "type": "array",
      "prefixItems": [
        {"const": "chain_version"},
        {"const": "id"},
        {"const": "timestamp"},
        {"const": "seq"},
        {"const": "prev_hash"},
        {"const": "agent_id"},
        {"const": "method"},
        {"const": "intent_category"},
        {"const": "authorized"},
        {"const": "reasoning"},
        {"const": "policy_decision"},
        {"const": "correlation_id"},
        {"const": "source"},
        {"const": "signal"},
        {"const": "approver_assertion"},
        {"const": "agent_spiffe"},
        {"const": "signature"},
        {"const": "key_id"},
        {"const": "event_kind"},
        {"const": "tenant"},
        {"const": "agent_name"},
        {"const": "actor_sub"},
        {"const": "actor_idp"},
        {"const": "payload_sha256"},
        {"const": "agent_kind"},
        {"const": "cost_micros"},
        {"const": "brain_evidence_sha256"},
        {"const": "brain_scores"},
        {"const": "tool_params_sha256"},
        {"const": "credential_fingerprint"},
        {"const": "upstream_id"},
        {"const": "tool_name"}
      ],
      "items": false,
      "minItems": 32,
      "maxItems": 32
    },
    "requiredValueFields": {
      "type": "array",
      "prefixItems": [
        {"const": "chain_version"},
        {"const": "id"},
        {"const": "timestamp"},
        {"const": "seq"},
        {"const": "prev_hash"},
        {"const": "agent_id"},
        {"const": "method"},
        {"const": "intent_category"},
        {"const": "authorized"},
        {"const": "reasoning"}
      ],
      "items": false,
      "minItems": 10,
      "maxItems": 10
    },
    "nullableFields": {
      "type": "array",
      "prefixItems": [
        {"const": "policy_decision"},
        {"const": "correlation_id"},
        {"const": "source"},
        {"const": "signal"},
        {"const": "approver_assertion"},
        {"const": "agent_spiffe"},
        {"const": "signature"},
        {"const": "key_id"},
        {"const": "event_kind"},
        {"const": "tenant"},
        {"const": "agent_name"},
        {"const": "actor_sub"},
        {"const": "actor_idp"},
        {"const": "payload_sha256"},
        {"const": "agent_kind"},
        {"const": "cost_micros"},
        {"const": "brain_evidence_sha256"},
        {"const": "brain_scores"},
        {"const": "tool_params_sha256"},
        {"const": "credential_fingerprint"},
        {"const": "upstream_id"},
        {"const": "tool_name"}
      ],
      "items": false,
      "minItems": 22,
      "maxItems": 22
    },
    "excludedState": {
      "type": "array",
      "minItems": 5,
      "maxItems": 5,
      "items": {"$ref": "#/$defs/excludedField"}
    },
    "payloadIntegrity": {
      "type": "object",
      "additionalProperties": false,
      "required": ["storage", "modes", "dualPayloadBehavior", "missingPairBehavior"],
      "properties": {
        "storage": {"const": "entry_payloads.payload_json"},
        "modes": {
          "type": "array",
          "prefixItems": [
            {
              "type": "object",
              "additionalProperties": false,
              "required": ["digestField", "canonicalBytesSource"],
              "properties": {
                "digestField": {"const": "payload_sha256"},
                "canonicalBytesSource": {"const": "payload_canonical_json"}
              }
            },
            {
              "type": "object",
              "additionalProperties": false,
              "required": ["digestField", "canonicalBytesSource"],
              "properties": {
                "digestField": {"const": "brain_evidence_sha256"},
                "canonicalBytesSource": {"const": "brain_evidence_canonical_json"}
              }
            }
          ],
          "items": false,
          "minItems": 2,
          "maxItems": 2
        },
        "dualPayloadBehavior": {"const": "reject-append"},
        "missingPairBehavior": {"const": "reject-append"}
      }
    },
    "verifiedCommitment": {
      "type": "object",
      "additionalProperties": false,
      "required": ["contract", "headHash", "length", "tailChainVersion", "invalidWalkBehavior"],
      "properties": {
        "contract": {"const": "clavenar.verified-chain/v1"},
        "headHash": {"const": "last-verified-entry-hash-or-genesis"},
        "length": {"const": "last-verified-seq"},
        "tailChainVersion": {"const": "last-verified-row-version-or-null"},
        "invalidWalkBehavior": {"const": "omit-commitment"}
      }
    },
    "adversarialMutations": {
      "type": "array",
      "minItems": 11,
      "maxItems": 11,
      "items": {
        "type": "object",
        "additionalProperties": false,
        "required": ["id", "expected"],
        "properties": {
          "id": {
            "type": "string",
            "enum": [
              "delete-row",
              "dual-payload",
              "mutate-committed-value",
              "mutate-null-presence",
              "mutate-payload-bytes",
              "mutate-predecessor",
              "mutate-sequence",
              "omit-field",
              "reorder-fields",
              "reorder-rows",
              "unknown-version"
            ]
          },
          "expected": {"enum": ["reject-append", "verification-fails"]}
        }
      }
    }
  },
  "$defs": {
    "excludedField": {
      "type": "object",
      "additionalProperties": false,
      "required": ["name", "classification", "integrity"],
      "properties": {
        "name": {
          "type": "string",
          "enum": [
            "deleted_at",
            "entry_hash",
            "entry_masked_params.masked_json",
            "entry_masked_params.retention_class",
            "entry_payloads.payload_json"
          ]
        },
        "classification": {
          "type": "string",
          "enum": [
            "derived-chain-head",
            "mutable-visibility-state",
            "purgeable-payload",
            "purge-policy",
            "sidecar-canonical-bytes"
          ]
        },
        "integrity": {
          "type": "string",
          "enum": [
            "derived-from-hashable-v5",
            "payload-digest-in-hashable-v5",
            "separate-data-lifecycle-boundary",
            "tool-params-digest-in-hashable-v5"
          ]
        }
      }
    }
  }
}
